{"$id":"https://touchline.local/schemas/recovery_fixture.schema.json","$schema":"https://json-schema.org/draft/2020-12/schema","additionalProperties":false,"description":"A genuine run of the real MatchWorkflow in which a deliberately invalid structured claim is vetoed by the Grounding step, the objection is routed back to the Explainer along the workflow's back edge, the corrected claim is verified, and the accepted overlay is produced. The trace is recorded from the run itself — never hand-authored. The fixture is a RECORDED TEST RUN on synthetic data: it must never be presented as a live incident.","properties":{"degradations":{"description":"Every degradation the run recorded. A valid fixture always has an empty list: any template fallback invalidates it.","items":{"type":"string"},"maxItems":0,"type":"array"},"fixture_format":{"const":"touchline.recovery-example","description":"Identifies this document as a grounding-recovery fixture.","type":"string"},"fixture_version":{"description":"Semver of this fixture instance. The file is versioned as recovery-example.v<major>.json; a major bump means a breaking schema change.","pattern":"^[0-9]+\\.[0-9]+\\.[0-9]+$","type":"string"},"generated_at":{"description":"When the generator ran, in UTC.","format":"date-time","type":"string"},"generator":{"additionalProperties":false,"properties":{"command":{"description":"The exact command line that produced this fixture, so it can be reproduced.","type":"string"},"name":{"type":"string"},"version":{"type":"string"}},"required":["name","version"],"type":"object"},"injected_fault":{"additionalProperties":false,"properties":{"attempt":{"const":1,"description":"The fault is only ever injected on the first attempt.","type":"integer"},"candidate_id":{"type":"string"},"claimed_value":{"description":"The value the injected claim stated.","type":"number"},"description":{"type":"string"},"metric":{"description":"The metric whose value was perturbed.","type":"string"},"true_value":{"description":"The value the event log recomputes.","type":"number"},"type":{"const":"metric_value_perturbation","description":"The fault kind: one metric value in the Explainer's first claim was moved beyond the grounding tolerance.","type":"string"}},"required":["type","description","candidate_id","metric","true_value","claimed_value","attempt"],"type":"object"},"kind":{"const":"recorded-test-run","description":"Always 'recorded-test-run'. This fixture is a test run, never a live incident.","type":"string"},"label":{"description":"The human-readable honesty label. Any UI that shows this fixture must surface it verbatim.","type":"string"},"providers":{"additionalProperties":false,"properties":{"correction_provider":{"description":"The provider that served the retry which the Grounding step accepted. The showcase video may only use a fixture where this is 'Microsoft Foundry'.","type":"string"},"explainer":{"description":"Display label of the provider that served the Explainer (e.g. 'Microsoft Foundry' or 'Template engine').","type":"string"},"narrator":{"type":"string"},"personalizer":{"type":"string"},"template_fallback_used":{"description":"Whether the deterministic template fallback claim was used anywhere in the run. The generator refuses to write the fixture when this is true.","type":"boolean"}},"required":["explainer","narrator","personalizer","correction_provider","template_fallback_used"],"type":"object"},"recovery":{"additionalProperties":false,"properties":{"acceptance":{"description":"The Grounding step's verdict on the corrected claim: accepted=true (GroundingVerdict, JSON form).","type":"object"},"corrected_claim":{"description":"The Explainer's claim after the veto, written in answer to the objection (Explanation, JSON form).","type":"object"},"invalid_claim":{"description":"The Explainer's first claim for the target candidate, with the injected fault (touchline.models.claims.Explanation, JSON form).","type":"object"},"overlay":{"description":"The finished overlay produced from the accepted claim (touchline.models.overlay.Overlay, JSON form).","type":"object"},"veto":{"description":"The Grounding step's verdict on the invalid claim: accepted=false with the specific reasons (touchline.orchestration.grounding.GroundingVerdict, JSON form).","type":"object"},"veto_trace_entry":{"description":"The trace hand-off grounding→explainer with accepted=false — the objection routed back along the back edge (touchline.orchestration.handoffs.Handoff, JSON form).","type":"object"}},"required":["invalid_claim","veto","veto_trace_entry","corrected_claim","acceptance","overlay"],"type":"object"},"repo":{"additionalProperties":false,"properties":{"app_version":{"description":"The service version (touchline.api.main.APP_VERSION).","type":"string"},"branch":{"type":"string"},"revision":{"description":"The git commit the code ran from (git rev-parse HEAD).","type":"string"}},"required":["revision","branch","app_version"],"type":"object"},"test_context":{"additionalProperties":false,"properties":{"audience":{"type":"string"},"isolation":{"description":"How the run stayed isolated from the live deployment.","type":"string"},"locale":{"type":"string"},"match_id":{"type":"string"},"match_minutes":{"description":"How much of the synthetic match the run analysed.","type":"number"},"seed":{"type":"integer"},"target_candidate_id":{"description":"The insight the fault was injected into.","type":"string"}},"required":["seed","match_minutes","match_id","audience","locale","target_candidate_id","isolation"],"type":"object"},"trace":{"description":"The hand-offs about the target candidate, in run order (touchline.orchestration.handoffs.Handoff, JSON form). The 'index' of each entry is its position in the run's full trace, so indices need not be contiguous here.","items":{"type":"object"},"minItems":5,"type":"array"}},"required":["fixture_format","fixture_version","kind","label","generated_at","generator","repo","test_context","providers","injected_fault","recovery","trace","degradations"],"title":"Grounding recovery example — recorded test run","type":"object"}